{
  "$schema": "../schemas/device-ui-template-v1.schema.json",
  "schemaVersion": 1,
  "id": "wifi-tv-modern",
  "name": "Modern TV",
  "deviceTypeId": "television",
  "connections": [
    "wifi"
  ],
  "renderer": "declarative",
  "columns": 4,
  "useFullWidth": true,
  "buttonCornerRadius": 10,
  "sectionCornerRadius": 16,
  "buttonHeight": 58,
  "buttonFontSize": 11,
  "iconFontSize": 25,
  "sections": [
    {
      "subtitle": "Gyorsvezérlők",
      "controls": [
        {
          "type": "tile",
          "label": "BE/KI",
          "command": "power",
          "icon": "⏻"
        },
        {
          "type": "tile",
          "label": "MENÜ",
          "command": "menu",
          "icon": "☰"
        },
        {
          "type": "tile",
          "label": "INFÓ",
          "command": "info",
          "icon": "ⓘ"
        },
        {
          "type": "tile",
          "label": "NÉMÍTÁS",
          "command": "mute",
          "icon": "🔇"
        },
        {
          "type": "tile",
          "label": "FORRÁS",
          "command": "source",
          "icon": "▣",
          "columnSpan": 2
        },
        {
          "type": "tile",
          "label": "MŰSORÚJSÁG",
          "command": "guide",
          "icon": "▤",
          "columnSpan": 2
        }
      ]
    },
    {
      "title": "NAVIGÁCIÓ",
      "subtitle": "Hangerő · irány · csatorna",
      "controls": [
        {
          "type": "tile",
          "label": "VOL +",
          "command": "volumeUp",
          "icon": "＋",
          "height": 64
        },
        {
          "type": "tile",
          "label": "",
          "command": "up",
          "icon": "▲",
          "iconOnly": true,
          "iconSize": 29,
          "columnSpan": 2,
          "height": 64
        },
        {
          "type": "tile",
          "label": "CH +",
          "command": "channelUp",
          "icon": "＋",
          "height": 64
        },
        {
          "type": "tile",
          "label": "VOL −",
          "command": "volumeDown",
          "icon": "−",
          "height": 64
        },
        {
          "type": "tile",
          "label": "",
          "command": "left",
          "icon": "◀",
          "iconOnly": true,
          "iconSize": 28,
          "height": 64
        },
        {
          "type": "tile",
          "label": "OK",
          "command": "ok",
          "icon": "●",
          "iconSize": 17,
          "height": 64
        },
        {
          "type": "tile",
          "label": "",
          "command": "right",
          "icon": "▶",
          "iconOnly": true,
          "iconSize": 28,
          "height": 64
        },
        {
          "type": "tile",
          "label": "BACK",
          "command": "back",
          "icon": "↩",
          "height": 64
        },
        {
          "type": "tile",
          "label": "",
          "command": "down",
          "icon": "▼",
          "iconOnly": true,
          "iconSize": 29,
          "columnSpan": 2,
          "height": 64
        },
        {
          "type": "tile",
          "label": "CH −",
          "command": "channelDown",
          "icon": "−",
          "height": 64
        }
      ]
    },
    {
      "title": "SZÍNES GOMBOK",
      "controls": [
        {
          "type": "tile",
          "label": "PIROS",
          "command": "red",
          "icon": "●",
          "backgroundColor": "#8A3542",
          "textColor": "#FFFFFF"
        },
        {
          "type": "tile",
          "label": "ZÖLD",
          "command": "green",
          "icon": "●",
          "backgroundColor": "#2F6C4E",
          "textColor": "#FFFFFF"
        },
        {
          "type": "tile",
          "label": "SÁRGA",
          "command": "yellow",
          "icon": "●",
          "backgroundColor": "#806B24",
          "textColor": "#FFFFFF"
        },
        {
          "type": "tile",
          "label": "KÉK",
          "command": "blue",
          "icon": "●",
          "backgroundColor": "#315F8C",
          "textColor": "#FFFFFF"
        }
      ]
    },
    {
      "title": "TV",
      "controls": [
        {
          "type": "tile",
          "label": "CSATORNALISTA",
          "command": "channelList",
          "icon": "☷",
          "columnSpan": 2
        },
        {
          "type": "tile",
          "label": "HOME",
          "command": "home",
          "icon": "⌂",
          "columnSpan": 2
        },
        {
          "type": "tile",
          "label": "KILÉPÉS",
          "command": "exit",
          "icon": "↪",
          "columnSpan": 2
        },
        {
          "type": "tile",
          "label": "FELIRAT",
          "command": "subtitle",
          "icon": "▱",
          "columnSpan": 2
        }
      ]
    },
    {
      "title": "MÉDIA",
      "controls": [
        {
          "type": "tile",
          "label": "",
          "command": "rewind",
          "icon": "⏪",
          "iconOnly": true
        },
        {
          "type": "tile",
          "label": "",
          "command": "play",
          "icon": "▶",
          "iconOnly": true
        },
        {
          "type": "tile",
          "label": "",
          "command": "pause",
          "icon": "Ⅱ",
          "iconOnly": true
        },
        {
          "type": "tile",
          "label": "",
          "command": "fastForward",
          "icon": "⏩",
          "iconOnly": true
        },
        {
          "type": "tile",
          "label": "STOP",
          "command": "stop",
          "icon": "■",
          "columnSpan": 2
        },
        {
          "type": "tile",
          "label": "OPCIÓK",
          "command": "tools",
          "icon": "⚙",
          "columnSpan": 2
        }
      ]
    }
  ]
}
