{
  "schemaVersion": 1,
  "id": "hue-blue-eye",
  "name": "Philips Hue Blue Eye",
  "deviceTypeId": "philips-hue",
  "connections": ["wifi"],
  "renderer": "builtin-hue",
  "columns": 1,
  "backgroundColor": "#0D1B2A",
  "foregroundColor": "#E7F6FF",
  "mutedTextColor": "#9DC9E3",
  "surfaceColor": "#132F4C",
  "accentColor": "#0084D0",
  "buttonColor": "#005A96",
  "buttonTextColor": "#FFFFFF",
  "borderColor": "#38516B",
  "themeSwitcherBackgroundColor": "#132F4C",
  "themeSwitcherTextColor": "#B8E4FF",
  "themeSwitcherBorderColor": "#38516B",
  "themeSwitcherText": "UI",
  "themeSwitcherOpacity": 0.72,
  "buttonCornerRadius": 8,
  "sectionCornerRadius": 10,
  "buttonHeight": 54,
  "buttonFontSize": 13,
  "iconFontSize": 22,
  "sections": []
}
