{
  "$schema": "../schemas/device-ui-template-v1.schema.json",
  "schemaVersion": 1,
  "id": "ir-tv-modern",
  "name": "Moderner TV",
  "deviceTypeId": "television",
  "connections": [
    "infrared"
  ],
  "renderer": "declarative",
  "columns": 4,
  "useFullWidth": true,
  "buttonCornerRadius": 10,
  "sectionCornerRadius": 16,
  "buttonHeight": 58,
  "buttonFontSize": 11,
  "iconFontSize": 25,
  "sections": [
    {
      "subtitle": "Schnellsteuerung",
      "controls": [
        {
          "type": "tile",
          "label": "EIN/AUS",
          "command": "Power",
          "icon": "⏻"
        },
        {
          "type": "tile",
          "label": "MENÜ",
          "command": "Menu",
          "icon": "☰"
        },
        {
          "type": "tile",
          "label": "INFO",
          "command": "Info",
          "icon": "ⓘ"
        },
        {
          "type": "tile",
          "label": "STUMM",
          "command": "Mute",
          "icon": "🔇"
        },
        {
          "type": "tile",
          "label": "QUELLE",
          "command": "Source",
          "icon": "▣",
          "columnSpan": 2
        },
        {
          "type": "tile",
          "label": "EPG",
          "command": "Guide",
          "icon": "▤",
          "columnSpan": 2
        }
      ]
    },
    {
      "title": "NAVIGATION",
      "subtitle": "Lautstärke · Richtung · Sender",
      "controls": [
        {
          "type": "tile",
          "label": "VOL +",
          "command": "VolumeUp",
          "icon": "＋",
          "height": 64
        },
        {
          "type": "tile",
          "label": "",
          "command": "Up",
          "icon": "▲",
          "iconOnly": true,
          "iconSize": 29,
          "columnSpan": 2,
          "height": 64
        },
        {
          "type": "tile",
          "label": "CH +",
          "command": "ChannelUp",
          "icon": "＋",
          "height": 64
        },
        {
          "type": "tile",
          "label": "VOL −",
          "command": "VolumeDown",
          "icon": "−",
          "height": 64
        },
        {
          "type": "tile",
          "label": "",
          "command": "Left",
          "icon": "◀",
          "iconOnly": true,
          "iconSize": 28,
          "height": 64
        },
        {
          "type": "tile",
          "label": "OK",
          "command": "Ok",
          "icon": "●",
          "iconSize": 17,
          "height": 64
        },
        {
          "type": "tile",
          "label": "",
          "command": "Right",
          "icon": "▶",
          "iconOnly": true,
          "iconSize": 28,
          "height": 64
        },
        {
          "type": "tile",
          "label": "ZURÜCK",
          "command": "Back",
          "icon": "↩",
          "height": 64
        },
        {
          "type": "tile",
          "label": "",
          "command": "Down",
          "icon": "▼",
          "iconOnly": true,
          "iconSize": 29,
          "columnSpan": 2,
          "height": 64
        },
        {
          "type": "tile",
          "label": "CH −",
          "command": "ChannelDown",
          "icon": "−",
          "height": 64
        }
      ]
    },
    {
      "title": "FARBTASTEN",
      "controls": [
        {
          "type": "tile",
          "label": "ROT",
          "command": "Red",
          "icon": "●",
          "backgroundColor": "#8A3542",
          "textColor": "#FFFFFF"
        },
        {
          "type": "tile",
          "label": "GRÜN",
          "command": "Green",
          "icon": "●",
          "backgroundColor": "#2F6C4E",
          "textColor": "#FFFFFF"
        },
        {
          "type": "tile",
          "label": "GELB",
          "command": "Yellow",
          "icon": "●",
          "backgroundColor": "#806B24",
          "textColor": "#FFFFFF"
        },
        {
          "type": "tile",
          "label": "BLAU",
          "command": "Blue",
          "icon": "●",
          "backgroundColor": "#315F8C",
          "textColor": "#FFFFFF"
        }
      ]
    },
    {
      "title": "TV",
      "controls": [
        {
          "type": "tile",
          "label": "SENDERLISTE",
          "command": "ChannelList",
          "icon": "☷",
          "columnSpan": 2
        },
        {
          "type": "tile",
          "label": "SMART HUB",
          "command": "SmartHub",
          "icon": "⌂",
          "columnSpan": 2
        },
        {
          "type": "tile",
          "label": "WERKZEUGE",
          "command": "Tools",
          "icon": "⚙",
          "columnSpan": 2
        },
        {
          "type": "tile",
          "label": "TEXT",
          "command": "TeletextMix",
          "icon": "▤",
          "columnSpan": 2
        }
      ]
    },
    {
      "title": "MEDIEN",
      "controls": [
        {
          "type": "tile",
          "label": "",
          "command": "Rewind",
          "icon": "⏪",
          "iconOnly": true
        },
        {
          "type": "tile",
          "label": "",
          "command": "Play",
          "icon": "▶",
          "iconOnly": true
        },
        {
          "type": "tile",
          "label": "",
          "command": "Pause",
          "icon": "Ⅱ",
          "iconOnly": true
        },
        {
          "type": "tile",
          "label": "",
          "command": "FastForward",
          "icon": "⏩",
          "iconOnly": true
        },
        {
          "type": "tile",
          "label": "STOP",
          "command": "Stop",
          "icon": "■",
          "columnSpan": 2
        },
        {
          "type": "tile",
          "label": "UNTERTITEL",
          "command": "Subtitle",
          "icon": "▱",
          "columnSpan": 2
        }
      ]
    }
  ]
}
